Name,Company,Role,Relationship Tier,Notes
Alice Johnson,HealthPlus Inc.,CEO,Strategic,"Longtime client, strong partner in wellness"
Michael Smith,WellnessCo,Head of Partnerships,High-Value,"Recent renewal, open to upsell"
Sofia Martinez,FutureCare,Account Manager,New Account,"Health plan prospect, first engagement"
David Lee,Zenith Health,Director of Wellness,Strategic,"Trusted advisor, leads wellness programs"
Emma Brown,Optima Life,Sales Executive,High-Value,"Recently promoted, exploring new partnership"
